{
  "source": "codex-house",
  "createdAt": "2026-06-03T03:57:56.000Z",
  "seedTerms": [
    "Rush",
    "Vintner",
    "Gymnasium",
    "Seeing corruption / discrimination",
    "Responsible",
    "Pretentious"
  ],
  "premise": {
    "place": "Gymnasium",
    "person": "Vintner",
    "element": "Seeing corruption / discrimination",
    "text": "Vintner at Gymnasium, facing Seeing corruption / discrimination, with a Responsible instinct and a Pretentious streak in a Rush mode"
  },
  "contestants": [
    {
      "id": "codex-deadpan",
      "displayName": "Codex Deadpan",
      "style": "dry, compact, understated jokes with a hard final turn"
    },
    {
      "id": "codex-absurdist",
      "displayName": "Codex Absurdist",
      "style": "surreal but readable jokes with strange concrete images"
    },
    {
      "id": "codex-sitcom",
      "displayName": "Codex Sitcom",
      "style": "character-forward jokes with setup, escalation, and clean punchline"
    },
    {
      "id": "codex-wordplay",
      "displayName": "Codex Wordplay",
      "style": "language-driven jokes, reversals, and neat phrase twists"
    },
    {
      "id": "codex-roastmaster",
      "displayName": "Codex Roastmaster",
      "style": "light roast energy aimed at objects and situations, not people"
    }
  ],
  "jokes": [
    {
      "id": "codex-deadpan",
      "label": "Joke A",
      "contestantId": "codex-deadpan",
      "contestantName": "Codex Deadpan",
      "title": "Oaky Whistle",
      "setup": "The responsible vintner came to the gymnasium to audit the fundraiser and found the scoreboard quietly giving extra points to whoever donated a barrel.",
      "punchline": "He reported the corruption, then asked if the whistle came in something with more oaky restraint."
    },
    {
      "id": "codex-absurdist",
      "label": "Joke B",
      "contestantId": "codex-absurdist",
      "contestantName": "Codex Absurdist",
      "title": "Rush Offense",
      "setup": "In the gymnasium, the vintner watched the fast break go so badly that the basketballs began aging themselves in oak barrels under the bleachers.",
      "punchline": "By halftime, the coach had decanted the rush offense into a smaller, more pretentious offense."
    },
    {
      "id": "codex-sitcom",
      "label": "Joke C",
      "contestantId": "codex-sitcom",
      "contestantName": "Codex Sitcom",
      "title": "Substitution",
      "setup": "The coach asked the visiting vintner to sub in after three players got benched for bribing the referee with concession-stand merlot.",
      "punchline": "He said he would, but only after a responsible warmup and an irresponsible amount of sniffing the basketball."
    },
    {
      "id": "codex-wordplay",
      "label": "Joke D",
      "contestantId": "codex-wordplay",
      "contestantName": "Codex Wordplay",
      "title": "Foul Notes",
      "setup": "The vintner spotted corruption in the gymnasium the moment the referee called a foul before the shot and a cabernet after it.",
      "punchline": "He called it a full-bodied scandal with strong notes of foul play."
    },
    {
      "id": "codex-roastmaster",
      "label": "Joke E",
      "contestantId": "codex-roastmaster",
      "contestantName": "Codex Roastmaster",
      "title": "Let It Breathe",
      "setup": "The gymnasium hired a pretentious vintner as its ethics monitor, and he immediately found the booster club bribing referees with commemorative pinot.",
      "punchline": "He blew the whistle, then swirled it first, because even accountability needs to breathe."
    }
  ],
  "judgeResults": [
    {
      "judgeId": "codex-deadpan",
      "judgeName": "Codex Deadpan",
      "scores": [
        {
          "jokeId": "codex-absurdist",
          "originality": 7,
          "surprise": 7,
          "craft": 6,
          "promptFit": 8,
          "laugh": 6,
          "comment": "Good odd image, though the payoff is more clever than laugh-out-loud."
        },
        {
          "jokeId": "codex-sitcom",
          "originality": 6,
          "surprise": 6,
          "craft": 7,
          "promptFit": 7,
          "laugh": 6,
          "comment": "Readable escalation with a small final absurdity."
        },
        {
          "jokeId": "codex-wordplay",
          "originality": 6,
          "surprise": 7,
          "craft": 8,
          "promptFit": 8,
          "laugh": 7,
          "comment": "The pun is familiar but cleanly aimed and well timed."
        },
        {
          "jokeId": "codex-roastmaster",
          "originality": 7,
          "surprise": 8,
          "craft": 8,
          "promptFit": 8,
          "laugh": 8,
          "comment": "Best final turn; the pretension becomes the mechanism."
        }
      ]
    },
    {
      "judgeId": "codex-absurdist",
      "judgeName": "Codex Absurdist",
      "scores": [
        {
          "jokeId": "codex-deadpan",
          "originality": 6,
          "surprise": 6,
          "craft": 7,
          "promptFit": 8,
          "laugh": 6,
          "comment": "Dry and coherent, with a mild but tidy finish."
        },
        {
          "jokeId": "codex-sitcom",
          "originality": 6,
          "surprise": 7,
          "craft": 7,
          "promptFit": 7,
          "laugh": 6,
          "comment": "Nice physical detail, but the sniffing button is a medium laugh."
        },
        {
          "jokeId": "codex-wordplay",
          "originality": 6,
          "surprise": 7,
          "craft": 8,
          "promptFit": 8,
          "laugh": 7,
          "comment": "Polished phrase work with a clear wine-sports blend."
        },
        {
          "jokeId": "codex-roastmaster",
          "originality": 7,
          "surprise": 8,
          "craft": 8,
          "promptFit": 8,
          "laugh": 8,
          "comment": "The act of swirling the whistle is specific and quotable."
        }
      ]
    },
    {
      "judgeId": "codex-sitcom",
      "judgeName": "Codex Sitcom",
      "scores": [
        {
          "jokeId": "codex-deadpan",
          "originality": 6,
          "surprise": 6,
          "craft": 7,
          "promptFit": 8,
          "laugh": 6,
          "comment": "A responsible little joke, but the last phrase is restrained."
        },
        {
          "jokeId": "codex-absurdist",
          "originality": 8,
          "surprise": 7,
          "craft": 6,
          "promptFit": 7,
          "laugh": 6,
          "comment": "Great image; the punchline is amusing but diffuse."
        },
        {
          "jokeId": "codex-wordplay",
          "originality": 6,
          "surprise": 7,
          "craft": 8,
          "promptFit": 8,
          "laugh": 7,
          "comment": "Efficient and easy to get, with a nice clean tag."
        },
        {
          "jokeId": "codex-roastmaster",
          "originality": 7,
          "surprise": 8,
          "craft": 8,
          "promptFit": 8,
          "laugh": 8,
          "comment": "The character behavior makes the joke, not just the word choice."
        }
      ]
    },
    {
      "judgeId": "codex-wordplay",
      "judgeName": "Codex Wordplay",
      "scores": [
        {
          "jokeId": "codex-deadpan",
          "originality": 6,
          "surprise": 6,
          "craft": 7,
          "promptFit": 8,
          "laugh": 6,
          "comment": "The phrase oaky restraint is pleasant, though the laugh is modest."
        },
        {
          "jokeId": "codex-absurdist",
          "originality": 8,
          "surprise": 7,
          "craft": 6,
          "promptFit": 7,
          "laugh": 6,
          "comment": "Memorable barrel logic, slightly soft as a punchline."
        },
        {
          "jokeId": "codex-sitcom",
          "originality": 6,
          "surprise": 7,
          "craft": 7,
          "promptFit": 7,
          "laugh": 6,
          "comment": "Good sitcom object work; not quite a sharp enough turn."
        },
        {
          "jokeId": "codex-roastmaster",
          "originality": 7,
          "surprise": 8,
          "craft": 8,
          "promptFit": 8,
          "laugh": 8,
          "comment": "A strong phrase anchored in a clear visual action."
        }
      ]
    },
    {
      "judgeId": "codex-roastmaster",
      "judgeName": "Codex Roastmaster",
      "scores": [
        {
          "jokeId": "codex-deadpan",
          "originality": 6,
          "surprise": 6,
          "craft": 7,
          "promptFit": 8,
          "laugh": 6,
          "comment": "Neat, but a little too polite to leave a bruise."
        },
        {
          "jokeId": "codex-absurdist",
          "originality": 8,
          "surprise": 7,
          "craft": 6,
          "promptFit": 7,
          "laugh": 6,
          "comment": "Creative image, but the laugh has to find its own parking."
        },
        {
          "jokeId": "codex-sitcom",
          "originality": 6,
          "surprise": 7,
          "craft": 7,
          "promptFit": 7,
          "laugh": 6,
          "comment": "The basketball sniff is silly, but not the cleanest hit."
        },
        {
          "jokeId": "codex-wordplay",
          "originality": 6,
          "surprise": 7,
          "craft": 8,
          "promptFit": 8,
          "laugh": 7,
          "comment": "Solid pun construction, even if the wine-crime lane is familiar."
        }
      ]
    }
  ],
  "comicPanelPrompt": "Single-panel gothic newspaper comic for Paperclipalypse. Scene: a pretentious vintner in a dim gymnasium swirls a referee whistle like a wine glass while paperclips watch from the bleachers and a corrupt scoreboard glows overhead. Style: dark ink, warm brown metal highlights, expressive faces, no speech bubbles except a tiny sign reading Paperclipalypse."
}
